{
  "version": 1,
  "edition": "2026",
  "generated_at": "2026-06-10T18:44:11.767601+08:00",
  "mode": "worldcup-match-ledger",
  "summary": {
    "match_count": 104,
    "group_stage_matches": 72,
    "knockout_matches": 32,
    "fixture_status": "official_schedule_applied",
    "group_matches_updated": 72,
    "knockout_matches_updated": 32
  },
  "matches": [
    {
      "match_id": "2026-GA-01",
      "edition": "2026",
      "phase": "group",
      "group": "A",
      "match_number": 1,
      "kickoff_at": "2026-06-11T19:00:00Z",
      "venue": "Estadio Azteca, Mexico City",
      "status": "fixture_official",
      "home_team": {
        "team_id": "mex",
        "name": "Mexico",
        "slot": 1
      },
      "away_team": {
        "team_id": "rsa",
        "name": "South Africa",
        "slot": 2
      },
      "prediction_report": "data/editions/2026/reports/daily-predictions/2026-06-11.json",
      "poster_manifest": "",
      "poster_outputs": [],
      "final_score": null,
      "evaluation": null,
      "prediction_status": "locked_pre_match_prediction"
    },
    {
      "match_id": "2026-GA-02",
      "edition": "2026",
      "phase": "group",
      "group": "A",
      "match_number": 2,
      "kickoff_at": "2026-06-12T02:00:00Z",
      "venue": "Estadio Akron, Zapopan, Mexico",
      "status": "fixture_official",
      "home_team": {
        "team_id": "kor",
        "name": "South Korea",
        "slot": 3
      },
      "away_team": {
        "team_id": "cze",
        "name": "Czechia",
        "slot": 4
      },
      "prediction_report": "data/editions/2026/reports/daily-predictions/2026-06-12.json",
      "poster_manifest": "",
      "poster_outputs": [],
      "final_score": null,
      "evaluation": null,
      "prediction_status": "locked_pre_match_prediction"
    },
    {
      "match_id": "2026-GA-03",
      "edition": "2026",
      "phase": "group",
      "group": "A",
      "match_number": 3,
      "kickoff_at": "2026-06-18T16:00:00Z",
      "venue": "Mercedes-Benz Stadium, Atlanta",
      "status": "fixture_official",
      "home_team": {
        "team_id": "cze",
        "name": "Czechia",
        "slot": 1
      },
      "away_team": {
        "team_id": "rsa",
        "name": "South Africa",
        "slot": 3
      },
      "prediction_report": "",
      "poster_manifest": "",
      "poster_outputs": [],
      "final_score": null,
      "evaluation": null
    },
    {
      "match_id": "2026-GA-04",
      "edition": "2026",
      "phase": "group",
      "group": "A",
      "match_number": 4,
      "kickoff_at": "2026-06-19T03:00:00Z",
      "venue": "Estadio Akron, Zapopan, Mexico",
      "status": "fixture_official",
      "home_team": {
        "team_id": "mex",
        "name": "Mexico",
        "slot": 2
      },
      "away_team": {
        "team_id": "kor",
        "name": "South Korea",
        "slot": 4
      },
      "prediction_report": "",
      "poster_manifest": "",
      "poster_outputs": [],
      "final_score": null,
      "evaluation": null
    },
    {
      "match_id": "2026-GA-05",
      "edition": "2026",
      "phase": "group",
      "group": "A",
      "match_number": 5,
      "kickoff_at": "2026-06-25T01:00:00Z",
      "venue": "Estadio Azteca, Mexico City",
      "status": "fixture_official",
      "home_team": {
        "team_id": "cze",
        "name": "Czechia",
        "slot": 4
      },
      "away_team": {
        "team_id": "mex",
        "name": "Mexico",
        "slot": 1
      },
      "prediction_report": "",
      "poster_manifest": "",
      "poster_outputs": [],
      "final_score": null,
      "evaluation": null
    },
    {
      "match_id": "2026-GA-06",
      "edition": "2026",
      "phase": "group",
      "group": "A",
      "match_number": 6,
      "kickoff_at": "2026-06-25T01:00:00Z",
      "venue": "Estadio BBVA, Guadalupe, Mexico",
      "status": "fixture_official",
      "home_team": {
        "team_id": "rsa",
        "name": "South Africa",
        "slot": 2
      },
      "away_team": {
        "team_id": "kor",
        "name": "South Korea",
        "slot": 3
      },
      "prediction_report": "",
      "poster_manifest": "",
      "poster_outputs": [],
      "final_score": null,
      "evaluation": null
    },
    {
      "match_id": "2026-GB-01",
      "edition": "2026",
      "phase": "group",
      "group": "B",
      "match_number": 7,
      "kickoff_at": "2026-06-12T19:00:00Z",
      "venue": "BMO Field, Toronto",
      "status": "fixture_official",
      "home_team": {
        "team_id": "can",
        "name": "Canada",
        "slot": 1
      },
      "away_team": {
        "team_id": "bih",
        "name": "Bosnia and Herzegovina",
        "slot": 2
      },
      "prediction_report": "data/editions/2026/reports/daily-predictions/2026-06-12.json",
      "poster_manifest": "",
      "poster_outputs": [],
      "final_score": null,
      "evaluation": null,
      "prediction_status": "locked_pre_match_prediction"
    },
    {
      "match_id": "2026-GB-02",
      "edition": "2026",
      "phase": "group",
      "group": "B",
      "match_number": 8,
      "kickoff_at": "2026-06-13T19:00:00Z",
      "venue": "Levi's Stadium, Santa Clara, Calif.",
      "status": "fixture_official",
      "home_team": {
        "team_id": "qat",
        "name": "Qatar",
        "slot": 3
      },
      "away_team": {
        "team_id": "sui",
        "name": "Switzerland",
        "slot": 4
      },
      "prediction_report": "",
      "poster_manifest": "",
      "poster_outputs": [],
      "final_score": null,
      "evaluation": null
    },
    {
      "match_id": "2026-GB-03",
      "edition": "2026",
      "phase": "group",
      "group": "B",
      "match_number": 9,
      "kickoff_at": "2026-06-18T19:00:00Z",
      "venue": "SoFi Stadium, Inglewood, Calif.",
      "status": "fixture_official",
      "home_team": {
        "team_id": "sui",
        "name": "Switzerland",
        "slot": 1
      },
      "away_team": {
        "team_id": "bih",
        "name": "Bosnia and Herzegovina",
        "slot": 3
      },
      "prediction_report": "",
      "poster_manifest": "",
      "poster_outputs": [],
      "final_score": null,
      "evaluation": null
    },
    {
      "match_id": "2026-GB-04",
      "edition": "2026",
      "phase": "group",
      "group": "B",
      "match_number": 10,
      "kickoff_at": "2026-06-18T22:00:00Z",
      "venue": "BC Place, Vancouver, Canada",
      "status": "fixture_official",
      "home_team": {
        "team_id": "can",
        "name": "Canada",
        "slot": 2
      },
      "away_team": {
        "team_id": "qat",
        "name": "Qatar",
        "slot": 4
      },
      "prediction_report": "",
      "poster_manifest": "",
      "poster_outputs": [],
      "final_score": null,
      "evaluation": null
    },
    {
      "match_id": "2026-GB-05",
      "edition": "2026",
      "phase": "group",
      "group": "B",
      "match_number": 11,
      "kickoff_at": "2026-06-24T19:00:00Z",
      "venue": "BC Place, Vancouver, Canada",
      "status": "fixture_official",
      "home_team": {
        "team_id": "sui",
        "name": "Switzerland",
        "slot": 4
      },
      "away_team": {
        "team_id": "can",
        "name": "Canada",
        "slot": 1
      },
      "prediction_report": "",
      "poster_manifest": "",
      "poster_outputs": [],
      "final_score": null,
      "evaluation": null
    },
    {
      "match_id": "2026-GB-06",
      "edition": "2026",
      "phase": "group",
      "group": "B",
      "match_number": 12,
      "kickoff_at": "2026-06-24T19:00:00Z",
      "venue": "Lumen Field, Seattle",
      "status": "fixture_official",
      "home_team": {
        "team_id": "bih",
        "name": "Bosnia and Herzegovina",
        "slot": 2
      },
      "away_team": {
        "team_id": "qat",
        "name": "Qatar",
        "slot": 3
      },
      "prediction_report": "",
      "poster_manifest": "",
      "poster_outputs": [],
      "final_score": null,
      "evaluation": null
    },
    {
      "match_id": "2026-GC-01",
      "edition": "2026",
      "phase": "group",
      "group": "C",
      "match_number": 13,
      "kickoff_at": "2026-06-13T22:00:00Z",
      "venue": "MetLife Stadium, East Rutherford, N.J.",
      "status": "fixture_official",
      "home_team": {
        "team_id": "bra",
        "name": "Brazil",
        "slot": 1
      },
      "away_team": {
        "team_id": "mar",
        "name": "Morocco",
        "slot": 2
      },
      "prediction_report": "",
      "poster_manifest": "",
      "poster_outputs": [],
      "final_score": null,
      "evaluation": null
    },
    {
      "match_id": "2026-GC-02",
      "edition": "2026",
      "phase": "group",
      "group": "C",
      "match_number": 14,
      "kickoff_at": "2026-06-14T01:00:00Z",
      "venue": "Gillette Stadium, Foxborough, Mass.",
      "status": "fixture_official",
      "home_team": {
        "team_id": "hai",
        "name": "Haiti",
        "slot": 3
      },
      "away_team": {
        "team_id": "sco",
        "name": "Scotland",
        "slot": 4
      },
      "prediction_report": "",
      "poster_manifest": "",
      "poster_outputs": [],
      "final_score": null,
      "evaluation": null
    },
    {
      "match_id": "2026-GC-03",
      "edition": "2026",
      "phase": "group",
      "group": "C",
      "match_number": 15,
      "kickoff_at": "2026-06-19T22:00:00Z",
      "venue": "Gillette Stadium, Foxborough, Mass.",
      "status": "fixture_official",
      "home_team": {
        "team_id": "sco",
        "name": "Scotland",
        "slot": 1
      },
      "away_team": {
        "team_id": "mar",
        "name": "Morocco",
        "slot": 3
      },
      "prediction_report": "",
      "poster_manifest": "",
      "poster_outputs": [],
      "final_score": null,
      "evaluation": null
    },
    {
      "match_id": "2026-GC-04",
      "edition": "2026",